{
  "$schema": "https://json-schema.org/draft/2020-12/schema",
  "$id": "validation.schema.json",
  "title": "Quorum Validation Capture",
  "type": "object",
  "required": [
    "task_id",
    "summary",
    "executed_at",
    "commands",
    "overall_result"
  ],
  "additionalProperties": false,
  "properties": {
    "task_id": {
      "type": "string",
      "pattern": "^[A-Z]+-[0-9]+(-[a-z])?$"
    },
    "summary": {
      "type": "string",
      "maxLength": 200,
      "minLength": 1
    },
    "executed_at": {
      "type": "string",
      "format": "date-time"
    },
    "commands": {
      "type": "array",
      "items": {
        "type": "object",
        "required": [
          "command",
          "exit_code",
          "duration_s",
          "output_excerpt"
        ],
        "additionalProperties": false,
        "properties": {
          "command": {
            "type": "string"
          },
          "exit_code": {
            "type": "integer"
          },
          "duration_s": {
            "type": "number",
            "minimum": 0
          },
          "output_excerpt": {
            "type": "string",
            "maxLength": 2000
          }
        }
      },
      "minItems": 1
    },
    "overall_result": {
      "type": "string",
      "enum": [
        "passed",
        "failed",
        "blocked"
      ]
    },
    "error_category": {
      "type": "string",
      "enum": [
        "logic",
        "dependency",
        "environment",
        "flaky",
        "unknown"
      ],
      "description": "Optional. Set when overall_result is failed or blocked. Distinguishes recoverable transient failures from code-level failures."
    },
    "tdd_evidence": {
      "type": "array",
      "description": "Optional per-acceptance red-to-green TDD evidence reconstructed by q-verify from 04.tdd_red_runs plus current green runs. Advisory only; does not determine overall_result.",
      "items": {
        "type": "object",
        "required": [
          "acceptance_id",
          "command",
          "red_exit_code",
          "green_exit_code"
        ],
        "additionalProperties": false,
        "properties": {
          "acceptance_id": {
            "type": "string",
            "pattern": "^AC-[0-9]+$"
          },
          "command": {
            "type": "string",
            "minLength": 1
          },
          "red_exit_code": {
            "type": "integer",
            "minimum": 0
          },
          "green_exit_code": {
            "type": "integer",
            "minimum": 0
          }
        }
      }
    }
  }
}
